timestamp-old,speaker,words,tags,highlight,timelink,timestamp
,Ngumbalo Harry:,"Very true. Like some of us Muslims, we had to eat anything that was given to us. Whether it was pork, forbidden fish and other foods we had to eat just to be able to work in the mines. We had to forgo many of the things.",religion,,,
,EM:,Going back to the first set of questions I asked those I talked to last time. Was there vetting done by the chiefs before recommending you to the Traditional Authority?,vetting,,,
,Unclear Respondent:,"Yes. They would want to find our if you are of good reputation in the village. If you paid your taxes, political cards, no criminal records etc. then, the chief would recommend you to the TA.",vetting,,,
,Unclear Respondent:,There were some taxes as well that we paid without us knowing. But the government Malawi and of South Africa knew everything about it including their agreements. these taxes were cut while in South Africa already.,taxes,,,
,EM:,"So, you mean while in South Africa, there were some hidden taxes that you were not aware of? ",taxes,,,
,Unclear Respondent:,"Yes. Some of these taxes included, death, funeral, graveyard, coffin taxes. They used to cut us even when you were not aware of. We only realized of these taxes when we came back home.",taxes,,,
,EM:,Were you paid back those taxes when you came back home alive?,taxes,,,
,Group:,"Oh, no. we were only receiving the documents with such taxes attached in. They were not paying us back. We don’t know where this money is.",taxes,,,
,EM:,"That’s unfair, big injustice. What about if you died in South Africa what happened?",taxes,,,
,Group:,"They would bury you there. Everything they would do it themselves without anyone. However, they would send the money to the next of kin suggested by you before your death.",taxes,,,
,EM:,Was this done with your consent where you had to sign?,taxes,,,
,Group:,"Not at all. We only realized this when we came back and when you had no powers to demand repayment of all the moneys accrued. But government of Malawi knew of these taxes and cuts.  Furthermore, when you die, they were not according you with your religious death or burial rituals. They were only burying you just like any other person.",taxes;religion,,,
,EM:,"Let us talk about the bonuses. I want to understand them. You told me that when your contract came to an end, they gave you a bonus book with an agreement that within six month you must report back to WNLA for you to avail for your bonuses. Failing which, you may not receive the total sum value of your bonuses. Is that correct?",bonuses,,,
,Group:,"Yes, that was the agreement.",bonuses,,,
,EM:,"Now, may those who have travelled more than once respond to this question.  Were you given the money inscribed in your bonus books upon reporting back within the six months?",bonuses,,,
[02:12:30],Ngumbalo Harry:,"In my case, when I reported back, I was not given money, rather I was indebted to start at the position I was working on in the previous contract. That was the bonus for me. If you were a timber boy, you resume work as a timber boy. In the mine, I was work on, it was not money per se for reporting early.  However, if you reported after 6 months, you were to restart with mine school process rather than going straight to the work you had in the previous contract. 132:30 Also, bonus meant that when you come will have the same salary/wage amount. But if you take more than 6 months, you will be changed the work category plus different wage. That’s what bonus was meant for. ",bonuses,,,
,Alabi Mitawa:,"As for me, at the end of my contract, they gave me the bonus book with an explanation that when I come back within the prescribed months (6), they would pay all the bonus benefits. Unfortunately, I did not make it back due to the WNLA closure in 1975. So, in my opinion, my money is still in South Africa.",bonuses,,,
,Pearson Kumbemba:,"Same with me, however, they had told me when I come back within 12months not six as others. ",bonuses,,,
,EM:,"So, the bonus was how much money?",bonuses,,,
,Pearson Kumbemba:,It was the salary for 12 months after a contract of 24months,bonuses,,,
,,"Took pics/scanned copies of bonuses, etc. Permission granted for website publishing",,,,
,EM:,"There is this wind going around that South African government is paying out some cash, like compensation to ex-miners. Would this be the bonuses we are talking about here? Please explain.",bonuses,,,
,Mmadi Masudi,"To some extent it is related to those bonuses being mentioned here. Remember these ex-miners were cut different taxes and contribution to their welfare such as death, coffins, burial places etc. but those who never accessed such funds have lost such funds. It is believed that some ex-miners with the help of other organization took the South African government to court over such unpaid bonuses and taxes by mining companies. The case was won, and South African government is forced to compensate those ex-miners in different countries including Malawi.",bonuses;taxes,,,
,EM:,"these were head tax paid by ex-miners without their knowledge. They only realized this when they came back home that they paid death, burial site, coffin taxes. So, since they were not paid back as they arrived alive in Malawi, such taxes are being claimed today by these ex-miners.",taxes,,,
,JW:,"Finally, how do you feel now to be called magaisa?",magaisa,,,
,Pearson Kumbemba:,We feel proud to be a magaisa. We feel good about it.,magaisa,,,