timestamp-old,speaker,words,tags,highlight,timelink,timestamp
,Matumula Mamu:,"No, not my children but robbers. They paralyzed my family development.",children;poverty,,,
,Useni Afiki:,"In my case, I was married but without a child when I left first for South Africa. But when I came back were blessed with four children. And after that, my wife became so abused to me. [You may wish to note that this is the case in the matrimonial marriages/tribes. Women have so many powers over their husbands since men are housed within their wives’ households.] So, I was forced to leave her and marry another woman. But I was very happy to take care of my children. They are now grown-ups. Big boys now. But their mother is still alive and with another man. ",marriage;children;divorce,,,
,EM:,"So, can we conclude that these children love you because you did take a good care of them while in South Africa and back home?",children,,,
,Useni Afiki:,Definitely. I really made feel proud of me knowing that their mom and I are separated and that I was there for them.,marriage;children;divorce,,,
,EM:,Are you married again?,marriage,,,
,Useni Afiki:,"Oh, sure am married again. So, children from the first and second marriage are happy that am taking a good care of them. They are all happy and am proud of them.",marriage;children,,,
,Ngumbalo Harry:,"The reason for me to go to South Africa was that later I can take care of my children. I achieved that most of them have gone to school. They are happy that I was able to send them to school. They know that their dad is loving, he went abroad for their sake.",children;education,,,
,EM:,This means that the WNLA trip made progress in your life?,,,,
,Ngumbalo Harry:,"Very much so. Imagine all my children have gone to school. Now one is a nurse, teacher, driver, and a manager. They all studied through the WNLA money. All the money I used to keep paid off.",children;education,,,
,EM:,"Oh, good to hear that. So, next, you are the son of the examiner. Talk to us about your experience, as a recipient.",,,,
,Mmadi Masudi:,Mmadi Masudi. Thanks. I am indeed a son of an examiner. I am the deputy secretary of MAM (Miners Association of Malawi).,Miners Association of Malawi,,,
,EM:,Good one. Now tell us about your experience that you were home while your dad was in South Africa. What was your experience?,,,,
,Mmadi Masudi,"Am going to talk as a child just as I experienced it. We had a very good relationship with our dad. He was very supportive to the family especially us children, sending us money regularly to pay school fees, food and upkeep. When he was coming back home, we were very excited as he brought us toys, chocolate, bicycles, groceries etc. we had high expectations. ",family;children;education;purchases;bicycles,,,
,EM:,How was the communication like with your dad while he was away?,communication,,,
,Mmadi Masudi,"We used to communicate through his friends especially those who were coming back home. They used to tell us how dad was doing and when we would expect his return. Also, sometimes over the weekends, he would call us or his relatives also in South Africa would call us through the phones.",communication;family,,,
,EM:,"Oh, so you had ground phone?",communication,,,
,Mmadi Masudi,"Yes, we had ground phone in the house. We used to hear and sometimes he would call to tell us how he was. So, communication was very easy.",communication,,,
,EM:,"Thank you for your experience. Now that you are back home, showbizzing with the stuff that you brought back from WNLA, how did you feel about those boys, girls, your peers who admired the way you looked? Secondly, those peers who never travelled to South Africa, how were they perceived by the people in the villages?",purchases;returning home,,,
,Useni Afiki:,"Say if their kids came to our homes, we were treating them just like our kids. If ours were drinking tea, we could also give them, no segregation.",returning home,,,
,EM:,"Oh ok, but I mean your peers?",returning home,,,
,Useni Afiki:,"They obvious feeling bad, they were admiring us. But we would also assist them with blankets if they didn’t have. If they were at our home with our kids, we would help them same way we did with our kids. ",children;returning home,,,
,EM:,"Oh, okay. How about others?",returning home,,,
,Tambuli Samson:,"The story of WNLA was a proud story so to speak especially when you have come back healthier, fit. When we came back and with that pomp, we definitely used to look down upon our peers who never travelled to South Africa. We forgot all the hardships in the mines. That was also a mark of new life. We could start businesses to feed our families. That way most of our peers felt we were much better than them.",returning home;entrepreneurship;family,,,
,EM:,"How about the people in the village, how did they perceive about those peers who did not travel to WNLA?",returning home,,,
,Tambuli Samson:,Those whom we found back home were viewed as failures and not real men. They could not go abroad as well. Weak men. They were also undermined and not regarded as strong men.,returning home,,,
,EM:,Any other to contribute?,returning home,,,
,Unclear Respondent:,"Honestly those who did not travel were taken as cowards. They were afraid of the mines, thinking they would die in the mines. But some of us were strong willed and took the risk and had this belief that if we die, the money will benefit our families and parents. ",returning home;family,,,
,EM:,"Now that you are back healthier, good looking, fitter etc., how did your parents feel?",returning home;family,,,
,Matumula Mamu:,"They felt very good. They looked at us with great happiness as they thought we would die while in the mines. This was according to the romours that people get accidents, lose body parts etc. while in the mines.",returning home,,,
,Ngumbalo Harry:,"I want to answer your earlier question where you wanted to know how people felt about our coming from WNLA. ",returning home,,,
,EM:,"Yes, go ahead.",returning home,,,
,Ngumbalo Harry:,"We saw those of our peers who never went to WNLA as cowards, we looked down upon them. Them too, felt like we are pompous and arrogant. They knew that we are now richer than them. A bit part of it was jealous on their part. We took them as lazy people who didn’t wan to do hard work.",returning home,,,
,EM:,"How about the parents of those who refused their children to travel to South Africa to work in mines, especially that you are now back home alive, without scars of injuries, accidents, with property (gumbagumba, bicycles, and blankets), how did they feel about you?",returning home;purchases;bicycles,,,
,Ngumbalo Harry:,"They felt very low, and full of jealous. Almost telling you don’t pass through this road with your sport 3 speeder bicycle. They felt we are too proud, pompous with our riches unlike their children they refused to go to work in WNLA.",returning home;bicycles,,,
,EM:,"You might have travelled say twenty in your group and that 4 or 5 remained in South Africa after their contracts. Now they married, have children, settled there and happily, but you chose to come back. Why drove you to come back?",returning home;marriage;children,,,
,Matumula Mamu:,"Our coming back was driven by the main objective of the journey…. which was to go to work to raise enough money to start families, businesses, support parents and children fees. Yes, there were other jobs and women there, but the drive was that home was so exciting and calling. This was always the case, homesickness never left us.",returning home;entrepreneurship;family;education;children,,,
,EM:,Anyone?,,,,
,Alabi Mitawa:,"When we left for South Africa, we had an agenda…...poverty. Some we left without shoes, without a trouser, we first wore a pair trouser in Blantyre on our way to South Africa. They dressed us well before leaving. Some short guys wearing long trousers and tall guys wearing short trousers. We never had watches though they gave us some wrist straps, not watches before leaving, these were numbers for everyone for identification. That was your number and name.",returning home;poverty;clothing,,,
,EM:,You were given right here in Blantyre?,,,,
[01:08:57],Alabi Mitawa:,"Yes. Though when we arrived in the mines, they were giving us another number different from this one. So, when I was in South Africa i always remembered that I left a wife and parents. So, each time, I used to send some money to my mother, and my wife. After two months without sending her some money, say K20, that would mean I was no longer interested in her. So, I used to send her at least K400 after months. That was really good money then. This and the vibe that people should see me that Alabi has come back and is cycling a good sporty bicycle, was always driving me to come back home. Even some people used to call us Chapagalu.",remittances;family;marriage;bicycles;chapagalu,,,
,EM:,What did Chapagalu mean?,chapagalu,,,
,Alabi Mitawa:,"This meant that, you went to South Africa as a dog, who has no eyes to see. But when you will come back as dog that has eyes open. We went as poor and we come back as someone who has eyes open able to dress up, cycle bicycles, own a big radio, well civilized as compared to the time we first left. So, we were called Chapa-galu. (Chapa means-wash; Galu means-dog). Despite being called such names, we were not demoralized. Like me I went three journeys starting from 1964. The boy the one I was sending to school, is the one who is dressing me up now. Look how I look. These are not clothes from South Africa. He went to school and now does business and feeds his family and looks after me. The benefit of WNLA.",chapagalu;education;children;clothing;family;returning home,,,
,EM:,Anyone?,,,,
,Pearson Kumbemba:,"Anyone who went to South Africa then, had an objective to achieve. In my case, I went to WNLA sorely to raise funds for my wedding. It is for that reason that I had to come back to marry my promised sweetheart. There was no point of staying behind as mtchona ( an emigrant who settles away from home). Honestly, those who called us Mchapagalu, were right as we left home for South Africa as not as civilized as we came back. We were cleaned, sharpened by the experience we got in the mines while in South Africa. Most people in this district, Fort Johnstone now Mangochi went to South Africa, and this developed the district. If WNLA and TEBA continued, would have developed the district so much as compared to other districts who had less men going to WNLA or TEBA. That is what I wanted to add to this.",marriage;chapagalu;Teba;Fort Johnstone;Mangochi,,,
,EM:,"Thanks, Mr. Kumbemba. Who else wants to add up?",,,,
,Beston Makhuva Fred:,In my I left so as to uplift poverty in my family. This drive helped me from being busy with women while in South Africa. I know many people were embroidered with sexual activities and seeking safe heaven in South Africa. But I was focusing on what I went there for. I didn’t go there to get rich per se but to earn a good living for myself and my family not to run away from my family.,family;poverty,,,
,EM:,"Is that so? Fine. Now that you were there in the mines, had different names. What names were you calling yourselves?",,,,
,Group:,We were called Malawians,,,,
,EM:,They were not calling you manyasa?,,,,
,Group:,Oh yes those from other countries called us manyasa but we never called ourselves that.,manyasa,,,
,EM:,"How about back home, what names were the villagers, or your peers call you?",,,,
,Group:,"They called us different names such as: maguduka or magaisa ",maguduka;magaisa,,,
,EM:,Meaning what?,,,,
,Group:,"That is Yao, meaning they are gone (maguduka) and are now back, they are finished their contract (Magaisa). ",maguduka;magaisa,,,
,EM:,What about amongst yourselves? What language or what did you call yourselves?,,,,
,Group:,"When we are on our own, we used to speak in Fanakalou so that others who did not travel to South Africa would not understand us. A secret language. So, wife and children of the ex-miners would not have understood anything.",Fanakalou,,,
,EM:,"What songs were you singing while in the mines, on your own in South Africa?",songs,,,
,Unclear Respondent:,"You see, were not working alone as Malawians. We worked with different people from different countries and cultures. We worked with Tswanas, Shanganis, and others. We could not sing our own songs as that would break the unity we had. However, we could sing a common song in fanakalou that everyone in the mine understood. ",songs;Fanakalou;Tswana people;Shangaan people,,,
,Group:,"Mostly the Shanganis liked singing unlike us, Malawians. We could only join them whenever they started. ",songs;Shangaan people,,,
,EM:,Like what songs?,songs,,,
,Group:,"They liked Chilala ma poisa, chilala ma poisa.",,,,
,EM:,What did that mean?,,,,
,Alabi Mitawa:,"It means in the mines we had men having sex with other men. So, when we see a police officer giving a gift to a man, we knew they were homosexuals (mathanyula). These are police within the mines. They had so many powers and could easily force to sleep with you. So, each time we saw that happening we sang such song.",homosexuality;songs,,,
,Unclear Respondent:,"Also on Sundays, we had social events where each country showcased their traditional dances. As from Malawi, we had Chongolo by Achewa from Lilongwe. Together with other countries’ cultural dances, we had a lovely afternoon in the halls, or mine stadiums. We had fun. We did not have to go outside to seek entertainment. This was only men’s entertainment.",dances;chongolo,,,
,EM:,"So, you meant chongolo was a Malawian dance?",dances;chongolo,,,
,Ngumbalo Harry:,"Not really. Chongolo was a mine school test, where we were tested blood strength. It was too hot in the mines, ranging from 30 to 40 degrees Celsius high. So not all men could get inside that. Hence, we had to be tested chongolo, blood test, to measure if you can to what levels in the mine. Like, me, I passed all levels hence I could work at any levels in the mines. Others could only go as far as second level due to their blood test.",medicine;health;chongolo,,,
,Alabi Mitawa:,"True, we were tested on the scale from morning to 12pm. Others could fall on the scale. It wasn’t an easy process. That process was called chongolo. Even the white men were also tested so measure how far they can go. Checking their energy levels.",medicine;health,,,
,EM:,Was this taking place in the Malawi? Or right in the mines?,medicine;health,,,
,Group:,"Was in the mines, just before we got in. we had to go through this test.",medicine;health,,,
,EM:,"So, what happened if you failed?",medicine;health,,,
,Alabi Mitawa:,"Actually, they had to give you energy injection. A very painful injection, they were injecting on your chest near the heart. After three days, you were gaining a lot of energy. We were receiving this injection 3times in 24 months, twice in 18 months. ",medicine;health,,,
,EM:,What was the name of this injection?,medicine;health,,,
,Group:,"Ohm, no idea as we got it from the doctors.",medicine;health,,,
,EM:,"So, you had to go to the hospital, or you received it right within the mines?",medicine;health,,,
,Group:,"Yes, we got it from the doctors within the mines",medicine;health,,,
,EM:,"Tell me, were the dances done individually or communally? Say all countries came together to showcase their cultural dances?",dances,,,
,Chitani Sane Amidu:,"All miners on Sunday came together and celebrated these cultural dances together. Shanganis, Sothos, Angolans, Malawians and even South Africans, we all came together in the hall or stadium and show case our cultural dances.",Shangaan people;Sotho people;Angolan people;dances,,,
,EM:,What time were these social events taking place?,,,,
,Pearson Kumbemba:,"All day. Started in the morning till evening. Some ingoma, nyau, were also being showcased by Malawians. We got the materials right there",dances,,,
,EM:,How did that affect you?,,,,
,Group:,"We were excited. We were reminded of our individual homes and cultures. Helping us not to forgo our cultures ",dances,,,
,EM:,"Oh, that was good. Did you have sports like football?",football,,,
,Group:,"Yes, especially after the traditional dances, we had soccer matches. Country versus country.",football,,,
,EM:,"Wow! Was Malawi winning? ",football,,,
,Group:,"Yes, we used to win and at times we could lose. We also used to play mine against mine during those social weekends. And we only had men as spectators without women supporters.",football,,,
,EM:,"So, did you have something in common with other miners from other countries?",,,,
,Pearson Kumbemba:,"Yes, especially the Shanganis, we had similar things even culturally. A bit different from other countries like Angola, Lesotho, etc.",Shangaan people;Angolan people;Sotho people,,,
,Group:,"Some other things were a bit similar for instance the dances and language of Malawians from Dedza and South Africans (Zulus, Xosas).",dances;language,,,
,EM:,"Now I am interested to know especially the dangers you may have encountered while prior to leaving for South Africa at Mapanga. You were being weighed on scale, tested, and even injected with different vaccines.  Firstly, were you weighed while naked or with clothes? And who was carrying such tests?",dangers;health;medicine,,,
,Group:,"Were weighed while naked in front of a white doctor from Thyolo hospital. [Thyolo is district next to Blantyre. This doctor would be coming from the tea and coffee estates clinics. He must have been well versed with these tests while working with the estate labourers, who may have gone through similar tests]",Thyolo;medicine,,,
,EM:,How did you feel being weighed and tested while naked?,medicine,,,
,Ngumbalo Harry:,"Testing us while naked was not right to be honest. It was sad and regrettable, unfortunately we had less power as we wanted to fight our own poverty.",medicine,,,
,EM:,"Did they request for your consent? Or inform you of the procedure? ",medicine,,,
[01:31:55],Ngumbalo Harry:,"No ways. We were only asked to take off our clothes and go straight to the scale. They were even touching us, our private parts, without respect. ",medicine,,,
,EM:,Was this done at Mapanga?,medicine;Mapanga,,,
,Ngumbalo Harry:,"Yes, this was at Mapanga. They were not even classifying us men from young men. All were naked before each other. Some had their uncles and grandparents there but were not spared of this. We exposed ourselves to this simply because, we want to alleviate our poverty. No choice.",medicine;Mapanga,,,
,EM:,"And, you did not have chance to complain these acts?",medicine,,,
,Group:," No. We were swallowing our pride and respect so that we get access to the contract with WNLA",medicine,,,
,Beston Makhuva Fred:,TEBA was different. We were even tested by a woman. While naked the lady would shake our manhood. This was very inhumane. We are human beings and not less human despite our poverty. This was done at Mzilikazi center in South Africa.,Teba;medicine;Mzilikazi,,,
,EM:,"Oh, with TEBA, this exercise was don’t right in South Africa not at Mapanga as was with WNLA?",Teba;Mapanga,,,
,Beston Makhuva Fred:,"Yes. That was it. It was a woman who was doing it. And she was very pompous and enjoying touching us without respect. ",medicine,,,
,EM:,How did you take that?,medicine,,,
,Beston Makhuva Fred:,"I had no choice. I was already in South Africa, on site, I could not go back home simply because I didn’t want to be touched by a woman. Plus, I have an agenda I wanted to achieve, ending my poverty. ",medicine,,,
,EM:,"That was bad. Now, what was the main reason for most parents refusing to let their children to go to WNLA?",family,,,
,Group:,"Mostly parents were afraid of death, accidents. They heard many rumours about the dangers in the mines.",family,,,
,EM:,"Now that you were there, experienced it, what would tell those parents?",family,,,
,Beston Makhuva Fred:,"It was not easy. You imagine travelling on a line after being tied up to several wires. You are facing death right there, though were well protected. We could see sharp stones facing us and we had to pass through them to the very deep down. ",dangers,,,
,Useni Afiki:,It was very hard work. Walking a long distance underground. But we were well equipped. Though those clothing attire if it gets worn out you must buy it yourself. But torches and others we were given by the office. We had boots. These boots get worn out fast due to the heat inside the mines.,dangers;purchases,,,
,EM:,How did all that affect your health?,health,,,
,Group:,"We had no choice, what we wanted was to get money, to support our families. However, when we got sick, they sent us back home, especially TB.",health;tuberculosis;remittances,,,
,EM:,"How come when you contracted the disease in the mine, should you go back home?",health,,,
,Group:,"Yes, they wanted a healthy working force. You know in the mine, there is too much dust. So, TB was always the common disease. This was why each morning before any work in the mine, they started watering all angles to control the dust. So, TB and Psychosis (SP) was always the issue. Also, in the mine there was no water. You could not drink water.",health;tuberculosis;mental health,,,
,,"Others disputed the point that in the mine you could not drink water, that in other mines, water was provided to the miners within the mines.",health,,,
,EM:,Was the elevator moving down with speed or normal speed?,dangers,,,
,Group:,"Oh, it went down at high speed. More than a car",dangers,,,
,EM:,Was that scary?,dangers,,,
,Group:,"6666m down at a high speed, very fast in 5 minutes. It was scary, though we got used to it, with no noise at all. ",dangers,,,
,EM:,Were you able to talk to each other while in the cape?,,,,
,Pearson Kumbemba:,"No, we did not talk to each other. We just travel at high speed. ",dangers,,,
,EM:,How did you feel when getting down?,,,,
,Pearson Kumbemba:,Some vomited when they arrived down. Even some private parts had to go in when going down. You only realized them back when you landed.,dangers,,,
,EM:,Were you prepared about all these risks before you got into the mine?,dangers,,,
,Group:,"We were not informed of such risks at all. Even then, we would still go inside to serve our objectives. Remember we had no options",dangers,,,
,EM:,"How about the ex-miners, who happened to be friends, would they share with you some of the dangers of working in the mines?",dangers,,,
,Group:,"No, they would never tell us. Even us did not want to tell anyone aspiring to go to WNLA about the dangers we faced in the mines. We kept it a secret.",dangers,,,
,EM:,Why would you keep it a secret from young men who are eager to go to WNLA?,dangers,,,
,Pearson Kumbemba:,It was because we did not want them to be afraid and give up from going to WNLA.,dangers,,,
,EM:,Was this an advice from the mine leaders or WNLA?,dangers,,,
,Group:,"We just developed this attitude. Nothing really. We wanted the new men to face the challenges themselves. Go and see for themselves. Also, that if they tell them, some will mock these ex-miners of the hardship.",dangers,,,
,EM:,Was that okay looking back at that attitude?,dangers,,,
,Group:,"No, it was not okay really. We regret. However, that was the trend by many of the ex-miners.",dangers,,,
[01:51:50],,[break and unclear conversation],,,,
,EM:,Can you come again?,,,,
,Unclear Respondent:,"In the mine in which I was working, if you don’t report for work one day for no apparent good reason, they would arrest you for 14 days and be help in the mine prison.",absenteeism,,,
,EM:,"Oh, is that so?",,,,
,Unclear Respondent:,"This was mostly with Malawians as we were very loyal unlike our colleagues from South Africa who were vocal and could fail to report to work any day they want without any punishment. We were very passionate about our work and passive. During holiday days, we could just remain within the mine. And if we were sick, we could go access treatment but not failing to report to work. ",absenteeism,,,
,EM:,Why would they arrest loyal and hardworking Malawians and take no action against lazy South Africans and other nations? I don’t understand the rationale.,absenteeism,,,
,Unclear Respondent:,"The issue is, we Malawians vowed to come to work hard and not to be lazy. So, we made an agreement with our government that we will not embarrass our country. So, not report to work for no good reason, was punished by 14 days imprisonment. ",absenteeism,,,
,"Unclear Respondent, different:","In my case in Impala, RPM, and Burgersfort, they did not arrest us for absenteeism. They instead cut our daily pay. They did not send us to prison. And in other cases, they would cut the salary only if you failed to report to work three times consecutively.",Impala Platinum;RPM Mine;Burgersfort;absenteeism,,,
,EM:,Let us talk about religion. We have our religious affiliations. Tell me how did your religion prepare you for this journey to work in the mine? Did it have any contribution?,religion,,,
,Group:,"Ohm, for us Muslims it did not help us in any way. We did not have to get any permission from it. So, it played no part.",religion,,,
,EM:,"Oh, okay. What about Christians?",religion,,,
,Unclear Respondent:,"I am a CCAP (Church of Central African Presbyterian). It had no impact either. We did not have to tell anyone ",religion,,,
,EM:,"While in the mines, how did your faith help you to persevere the hard labour you encountered?",religion,,,
,Pearson Kumbemba:,"Our different faiths really made us strong and persevere all the hardship we encountered daily in the mines. We knew soon we shall be out of this and be ready to live a better life out there. It was a sacrifice to some extent. ",religion,,,
