timestamp-old,speaker,words,tags,highlight,timelink,timestamp
,,Transcription/Translation from Chichewa,,,,
,,"A formal introduction was done. Interviewees were welcomed, settled, and told what the interview was all about by both Julie and Elias.",,,,
,JW:,"I conducted similar interviews in Mexico about people working in the mines like you. I began to wonder about the history of the people from whom I have contacts in many different parts of the world including Malawi. So, with the help of Mr. Elias Mandala, I am here about asking you about your experiences if you are willing to share with me. And I will be publishing a book about this. I also ask if I may have permission to include your stories. And you can let me know if I can use your names or not. If you would like I want to put these interviews online, so that your children and grandchildren can find them, but only with your permission. ",,,,
,EM:,[translated the question],,,,
,JW:,"With your permission, would I use your names?",,,,
,Group:,"No, problem, you may go ahead with publishing in a book, on website, and use our names as they are presented",,,,
,JW:,"Thank you. So, we may be start with the new men, to introduce themselves, when they went to South Africa, and where they are from? You want to do that?",,,,
,EM:,"Yes, sure let us do that. So, may get the new members that I never had an interview with last time I visited here? Please mention your names clearly, where you come from, years you travelled to South Africa, how many times.",,,,
,Kaliza Bazilio:,"Kaliza Bazilio, born 1948, Went to South Africa in 1972 (22 August started work in the mine) and came back in 1974, worked in the mine called Doornfontein.",Doornfontein,,,
,EM:,So when you came back you never went back?,,,,
,Kaliza Bazilio:,"No, I only went once. Though, I wanted to go again, unfortunately due to the plane crash meant I could not go again.",1974 plane crash,,,
,EM:,Next,,,,
,Beston Makhuva Fred:,"Beston Makhuva Fred, born 1950, went to South Africa in 1971 and came back in 1974. I travelled three (3) times. WNLA went once, and when they were closing, I was still there. The second and third journeys were under TEBA. And they closed TEBA when I was also there. I went last in 1986 and in 1989.",Teba,,,
,EM:,Were you married when you first left for WNLA in 1971?,,,,
,Beston Makhuva Fred:,I left for WNLA when I was married with two children.,marriage;children,,,
,JW:,Do you remember which mine did you work in 1971?,,,,
,Beston Makhuva Fred:,"Yes, Vaalais (sp)",Vaal Reefs,,,
,Kaliza Bazilio:,"I went to Impala Platinum ",Impala Platinum,,,
,EM:,"Kaliza Bazilio, you did not tell me if you were married the time, you made your journey to South Africa?",,,,
,Kaliza Bazilio:,I was then married and with two children,marriage;children,,,
,EM:,Next please,,,,
,Edward Lokote:,"I am Edward Lokote, born in 1949. I went once to WNLA, in 1972 to 1974.",,,,
,EM:,Did you manage to go again?,,,,
,Edward Lokote:,"Nope, I only went once. ",,,,
,EM:,Were you married then?,,,,
,Edward Lokote:,"No, I was not married then.",marriage,,,
,EM:,"Oh, you went as there as saint? Laughs",,,,
,Edward Lokote:,"Actually, I was married but the time I left I was divorced.",marriage;divorce,,,
,EM:,"Sorry to ask, why it ended?",divorce,,,
,Edward Lokote:,"Because I had nothing. She ran away from my poverty. Women are of different categories. Other love for money. Seeing my poverty, she left me for another man.",marriage;divorce,,,
,EM:,"That’s painful, sorry. So, you too had only one journey?",,,,
,Edward Lokote:,Yes.,,,,
,EM:,Next Please,,,,
,Chitani Sane Amidu:,"My name is Chitani Sane Amidu, born in 1950. ",,,,
,EM:,When did you travel first to South Africa?,,,,
,Chitani Sane Amidu:,"I travelled first in 1969 back in 1971, back in 1972 and back in 1974, and back in 1974. I was there when the plane crashed.",1974 plane crash,,,
,EM:,"So, you finished in 1975?",,,,
,Chitani Sane Amidu:,"Yes, I finished in 1975 when WNLA closed. Thereafter, I went three times under TEBA. [Between 1980 and 1989 when Teba also closed]",Teba,,,
,EM:,Were you married then?,,,,
,Chitani Sane Amidu:,The first journey (WNLA 1969) I was not married then. I married when I came back home,marriage,,,
,EM:,That’s when you came back in 1972?,,,,
,Chitani Sane Amidu:,Yes. Now I have children,marriage;children,,,
,EM:,Where did you marry? Here in Malawi?,,,,
,Chitani Sane Amidu:,"Yes, I married here in Malawi.",marriage,,,
,EM:,"Who is next? (Welcomed the newcomer, Mr. Hussein Afiki, who was still on the way when we started the interviews.) Sorry, we had already started. But we can continue with knowing, what is your name?",,,,
,Useni Afiki:,My name is Useni Afiki.,,,,
,EM:,"You are Hussein Afiki right. When were you born, Sir?",,,,
,Useni Afiki:,"Ohm I would not remember but am old enough. [Sign that he doesn’t know he was born, which is the case with most of the old fellows who never went to school in the colonial period)",,,,
,EM:,"So, do you remember when you first to South Africa to work in the WNLA mine?",,,,
,Useni Afiki:,I think I do remember. It was in 1974 because before I came back home that’s when we heard about the plane crash. And that marked the end of WNLA.,1974 plane crash,,,
,EM:,"So, you came back in 1975 that was it?",,,,
,Useni Afiki:,"Yes, that was it. I never went back till Teba years",Teba,,,
,EM:,Were you married when you first left for South Africa?,,,,
,Useni Afiki:,"Yes, I was married but with no child. I was in my youth.",marriage;children,,,
,JW:,What mine did he work on when he first went to South Africa?,,,,
,Useni Afiki:,I worked at Impula Mine.,Impala Platinum,,,
,EM:,"How about you, Mr. Amidu?",,,,
,Chitani Sane Amidu:,"I went to RPM Mine, the second journey was shifted to Vendeorsport, then, the third trip was sent to Impala Mine.",RPM Mine;Vendeorsport;Impala Platinum,,,
,EM:,"Oh, I see",,,,
,Chitani Sane Amidu:,"Teba, I went three times and placed on the same mine",Teba,,,
,EM:,"Wow, to the point of knowing you, and becoming a landlord.",,,,
,Group:,[laughs],,,,
,EM:,"I think we have established a good introduction, and now we can continue.",,,,
,JW:,"Oh ok, great. You can go on asking them why they really left their homes, their comfort zones to work in the mines in South Africa.",,,,
,EM:,"Oh, okay let me do that. I already heard from my friends, those we met previously on what motivated you to leave home for south Africa to work in the mines? Most of you cited poverty to be the main reason for your flight to South Africa. How about the new members? Can you also tell me your reasons?",,,,
,Chitani Sane Amidu:,"Like me, I was driven by poverty at my parents’ home. So, seeing friends going and coming from working in the mines in South Africa, I felt like doing the same. They changed the face of their families. I wanted to do the same. Although, the money was not that good, but still changed our families in different ways.",poverty;family,,,
,EM:,"Apart from the poverty itself, there should be something unique that motivated you to go to South Africa?",,,,
,Chitani Sane Amidu:,"In my case, apart from the poverty, I wanted to come back to start a business. Something that would give me a living from. Especially coming from a business background.",poverty;entrepreneurship,,,
,EM:,Then you were not married yet?,,,,
,Chitani Sane Amidu:,"Actually, first trip, I wasn’t married but the second one. And I had left a child the second one. Now oh they are all big men. ",marriage;children,,,
,EM:,"Oh, I see, and probably looking after you?",,,,
,Chitani Sane Amidu:,"Yes, they are looking after me, buying jackets here and there (laughs). The kids are old too now",children,,,
,EM:,Any other wants to add as to what really motivated you to leave Malawi to go work in the mines in South Africa.,,,,
,Kaliza Bazilio:,"Let me add my voice to this, Sir.",,,,
,EM:,Go ahead.,,,,
,Kaliza Bazilio:,"In my case, I was first lured by my friends who came back with loads of stuffs. They managed to build houses for themselves etc. I was indeed motivated by that. I thought I was going to do the same. ",friends,,,
,EM:,How did it turn out to be if you don’t mind?,,,,
,Kaliza Bazilio:,"Actually, when I came back, I did manage to bring clothes and blankets for my family. Their faces were lit by what I brought them. They felt it that our son was really coming from abroad. Unfortunately, WNLA stopped before I built a house for myself or for my family. Apart from this, I still managed to give my family a new lease of life. If only I managed to go twice or thrice to South Africa, I could really have changed the face of my family and village. With that spirit of working hard, I then went to Blantyre and found work at Kamuzu’s house (Sanjika State House). I worked for two years there.",family;purchases;Sanjika State House,,,
,EM:,Oooh really? And you worked as what?,,,,
,Kaliza Bazilio:,I worked as garden boy,Sanjika State House,,,
,EM:,Wow! That was something else.,,,,
,Kaliza Bazilio:,"Yes, in 1976 to 1977. We were hundreds of people lined up at Sanjika State Residence for interviews. Only ten of us were picked. ",Sanjika State House,,,
,EM:,"So, what made you stand out?",,,,
,Kaliza Bazilio:,"Oh well, we were asked questions of where we come from, what work we did before, our criminal records, if we paid our taxes, and political party cards (MCP).",Sanjika State House,,,
,EM:,Did you not tell them about your mine (WNLA) experience?,,,,
,Kaliza Bazilio:,"Yes, I did and that made them believe the hard worker in me. Probably that’s why they hired me. I was employed on 26thMarch 1976 and left in 1977, the time of the uprising on Muwalo. [One of the political figures, a former faithful who later challenged Dr, Kamuzu Banda. He was hanged to death]",Sanjika State House;Albert Muwalo,,,
,EM:,"Oh okay, good to know. So basically, you were attracted by what your peers brought back home.",,,,
,Kaliza Bazilio:,"Exactly, they brought with them Wilson hats, bicycles, blankets, beautiful clothes, attires, radios (Gumba gumba). So, I felt compelled to go to. And went there, worked for two years, without any accident, though worked deep down the mine.",purchases;bicycles;radio;clothing,,,
,EM:,Thanks for sharing. How about you Mr. Edward Lokote?,,,,
,Edward Lokote:,"Similar story. When you see those who came back from working in the mines, I felt called to also go and do the same. I was attracted by the big luggage they brought, bicycles, blankets, strange clothes, radios, and some built good houses. I felt I am not a man enough if I didn’t go and do like what others did. So, I admired the others.",purchases;bicycles;radios;clothing,,,
,EM:,"So, you mean to say bicycle was a prestigious item around here, in your villages in those days?",bicycles,,,
,Edward Lokote:,"Oh yes! Oh yes bicycle was something else. Especially those sporty with gears. We would line up to see those cycling them with great admiration. That alone could drive you to aspire to go to South Africa to work in the mines even when we used to hear of terrifying stories. ",bicycles,,,
,EM:,So that bicycle aspect drove you mad besides poverty?,bicycles,,,
,Edward Lokote:,"Exactly, Sir. ",bicycles,,,
,EM:,"Tell me, were you bringing these six geared sporty bicycles from South Africa?",bicycles,,,
,Edward Lokote:,"No, we were buying them here, in Blantyre. (Group answered the same). When we arrived in Blantyre from South Africa, the Asian traders knew of our coming and we would need to buy the bicycles. So, they were there ready for purchase. They were selling at K28 (28 Kwacha). That’s hummer type of bicycles and others were K14 (14 Kwacha). Also, those bicycles we would sell them back home at K14 during famine.",bicycles;famine,,,
,EM:,Oh! You could sell them during famine time that you buy food?,bicycles;famine,,,
,Edward Lokote:,Yes.,bicycles;famine,,,
,EM:,"So, what exact thing that motivated you to leave your parents to go to work in the mines?",,,,
,Edward Lokote:,"When I dropped out of school due to our poverty of my family, I decided that I work so hard to let my brothers manage to go to school. So, the only option to get the fees was for me to go to work in the mines in South Africa. ",education;poverty;family,,,
,EM:,"So, did you manage to achieve this goal?",,,,
,Edward Lokote:,"Yes. I did manage to get my brother attend schools which I did not manage to finish. I knew when they finish school, they will be able to take care of themselves and others in the family. So, I feel I achieved my goal of going to work in the mines.",education;family,,,
,EM:,Anyone who wants to share?,,,,
,Useni Afiki:,Can also share?,,,,
,EM:,Go ahead please.,,,,
,Useni Afiki:,"In my case, it was the poverty at home. Hence, I decided to migrate that I manage to get some money that can assist my family come out of poverty. I knew I needed to get good money that when I come home, I could also buy cows, land to build houses for rentals.",poverty;entrepreneurship,,,
,EM:,"So, you were not lured by radios (gumba gumba), flashy bicycles, blankets (Tchale), etc.?",purchases;bicycles;radios,,,
,Useni Afiki:,"Not really, though they did motivate, but on a lesser level as compared to the issues I mentioned above. So, I thank God that I did manage to go to WNLA and brought the things I wanted. To me that was very successful. But that money that I brought was slowly finishing as many relatives looked up to me, as the only well to do person. ",purchases;family,,,
,EM:,Is that so?,,,,
,Useni Afiki:,"Yes, and I had to look for a cooking job from a well to do person, Mr. Lalabi, who had a farm within Mangochi.",Mangochi,,,
,EM:,Was Mr. Lalabi a white man or local?,Mangochi,,,
,Useni Afiki:,"Yes, he was Greek. I worked there for several years, till had my wife, children while there. When I decided to leave, I went back home and opened a garden, where I am till today. that’s my story.",Mangochi;marriage;children,,,
,EM:,"Thank you so much, Sir. Is there anyone who wants to add to the reasons for your going to South Africa? My old team can chip if you feel so.",,,,
,Pearson Kumbemba:,"Yes, let add my voice. The first thing that led most of us to go to South Africa is none other than extreme poverty. The government had no other incentives or alternatives. This was the main reason.",poverty,,,
,EM:,"Oh ok, go on secondly?",,,,
,Pearson Kumbemba:,The second reason is that we were lured by those returnees. What they were bringing home is what attracted us.,purchases,,,
,EM:,"Alright, like what?",,,,
,Pearson Kumbemba:,"Like what my friends previously mentioned. Like bicycles, blankets (Tchale- very thick and heavy blankets, very fashionable in the 70s), radios (chigumbagumba-big radios that play using records, very popular amongst the returnees in 80s). Having said that, personally, I was driven by the desire to get money so that when I come back home, I can marry. Remember, I went to South Africa while I was very young, fresh from school, and had nothing to show off to my wife to be. So, I left for South Africa, worked, kept my money, and when I came back, I married my wife. After marriage, first year I was blessed with a child. I used the same money from WNLA to send him to school. So, most of my children went to school using the same money.",purchases;bicycles;radios;marriage;children;education,,,
,EM:,"Going back to the property especially bicycle, what meaning did it have amongst the young and old men in the 70s?",bicycles,,,
,Pearson Kumbemba:,"Bicycle had special duty at home. It brought development, transporting stuffs plus when the children are ill, we could use it to take them to the hospital. So, bicycle was just for fashion, or show off, but it was the main household transport. Very reliable too.",bicycles;children,,,
,EM:,Oh! Thanks for sharing. Anyone willing to say something?,,,,
,Ngumbalo Harry:,"Yes, I want to add to what others have already said. So basically, poverty was the main issue, and the attractiveness of the men who returned from South Africa. However, what really drove me was this, that when I come back, I get to marry my sweetheart. I wanted to have a beautiful wedding because I would have enough money to achieve this goal. Secondly, when I come back, I will have enough money to build my own beautiful house to live with my new family. A beautiful home for all the equipment that others have already mention above. I didn’t want that such expensive equipment to be kept outside or kept at someone’s home, no, but well kept within my own house. About the bicycle…",poverty;marriage;children;purchases,,,
,EM:,"So, you too bought a bicycle?",bicycles,,,
,Ngumbalo Harry:,"Yes, and a portable radio, good shoes, jean trousers. I did not buy Gumbagumba (big radio). So, I managed to build a house, and married with seven (7) children. Three (3) died and I remained with four (4) children. These four, I sent them all to school. And now I sit down and thank WNLA to have profited me.",bicycles;radio;purchases;children;education,,,
,EM:,I think I have exhausted this question. We can move to the next question.,,,,
,JW:,"Ask about their clothing before and after they came back. Were they able to buy hats, boots…?",clothing,,,
,EM:,"Good one. We understand that before you left for South Africa you were in absolute poverty, and now that you went and came back home what was your clothing fashion or attire? What kind of clothing did you bring with you back home? This question is open to everyone. Any takers?",clothing,,,
,Group:,"We came back very changed as we brought new clothes, trending clothes like shoes called JT (pronounced as Jon Tee-very sharp pointed shoes), more like cowboy boots.",clothing,,,
,JW:,Why Jon Tee (cowboy shoes?),clothing,,,
,Unclear Respondent:,"This was the trending shoes. Most young men used to wear that as fashion. So, when we arrived back home, girls knew that we truly came back from abroad, WNLA boys. ",clothing,,,
,Unclear Respondent:,"We also used to wear flair pair of trousers, combined with Wilson hat.",clothing,,,
,EM:,What kind of hat?,clothing,,,
,Unclear Respondent:,Wilson hat. With ties,clothing,,,
,EM:,What kind of ties? Short or long and big?,clothing,,,
,Unclear Respondent:,Short ones. We looked like a gentleman from South Africa,clothing,,,
,Group:,[laughs],,,,
,Unclear Respondent:,"So, we bought suits.",clothing,,,
,JW:,Why you bought suits?,clothing,,,
,Unclear Respondent:,Ambition. This indicated that this is the retired man from South Africa,clothing,,,
,EM:,"Anyone who wants to add on this attire question? You have told us about JT boots, ties, suits.",clothing,,,
,Unclear Respondent:,"We brought many different clothes. Some brought suits, terevira trousers and shirts.",clothing,,,
,EM:,What are terevira?,clothing,,,
,Unclear Respondent:,"This could be shirt or trousers, that you could iron today and after a week would never lose its shape. Some called crown fashion",clothing,,,
,EM:,"So, was this in fashion in those days? And in black colour?",clothing,,,
,Unclear Respondent:,"Yes, that was a mark of fashionable men from South Africa. Oh, it had to be in black colours",clothing,,,
,EM:,"So, both shirt and trousers had to be black? And of terevira fashion?",clothing,,,
,"Unclear Respondent, different:","Yes. Shirt could be of any colours, but perfect man had to be both black. It was nice, and people admired us unlike these days.",clothing,,,
,"Unclear Respondent, different:",Belly bottom were also in fashion.,clothing,,,
,EM:,"Oh, belly bottom? What was that?",clothing,,,
,Unclear Respondent:,"These are trousers with flair touch down there. Simply called flair trousers. Were very popular among us, returnees.",clothing,,,
,JW:,"Oh, those with open bottoms. Oh yes, my dad had those too, bell bottoms.",clothing,,,
,EM:,"Anyone else? If not, let’s talk about the hats. Were you imitating South Africans or what you watched in the movies?",clothing,,,
,Unclear Respondent:,"No, we saw the local South Africans wearing. So were enticed to buy and showbiz in the streets back home.",clothing,,,
,Unclear Respondent:,"Actually, we would buy them in South Africa, but bring them home. We would dress up only when we arrived in Malawi at Ngumbe before we left for our respective homes. This was to differentiate with the local men who never went to WNLA. The clothing alone would identify us as true men who just arrived from South Africa.",clothing;Ngumbe,,,
,JW:,So how was the Wilson hat look like?,clothing,,,
,EM:,Wilson hat looked very close to cowboy’s hat. Round top with a beautiful feather on the ring.,clothing,,,
,Unclear Respondent:,"We also had safari suit. Which also made us look very special, and unique.",clothing,,,
,EM:,How does it look like? Describe please,clothing,,,
,Unclear Respondent:,"It is a short-sleeved shirt, with buttons from top down. It has four pockets two on each side of the shirt, one up and one down, with cuts on both sides. Both, trousers, and shirt must be of the same colour. And you do not tuck in the shirt.",clothing,,,
,JW:,"So, you would bring with you the safari suit?",clothing,,,
,Unclear Respondent:,Yes,clothing,,,
,EM:,"So, it was in fashion in South Africa as well?",clothing,,,
,Unclear Respondent:,Yes.,clothing,,,
,JW:,"So, how did you feel when you came back home and dressing in those attires?",clothing,,,
,Group:,"Oh! We did feel great, something like showbiz, and to some extent we were creating envy in those who were watching us. Some started hating us while others were lured by this and aspired to also go to South Africa.",clothing;purchases,,,
,Unclear Respondent:,"Like me, when I woke up in the morning people knew that this guy is from South Africa due to the clothes I was wearing, plus the skin changed, was soft and good looking unlike my friends who are at home. You did not have to tell them that I am from South Africa. Even without a bicycle, just mere clothes would tell that this person is from South Africa.",clothing;bicycles,,,
,EM:,"So, the showbiz really attracted many young men to start the process of going to work for WNLA as well. Now, for some of you who went to WNLA while married and with kids, and those who went for the second time after getting married with children. What I want to know is the kind of relationship you had with your wife and children while away.",marriage;children,,,
,Chitani Sane Amidu:,"When we arrived at our workplace, we always tried to keep in touch with our families and kids back home. And the little that we get, we tried to send back home to make sure they lack anything. When, a child gets sick, we could send something that will take the child to the hospital. That way, we created good relationship with our family back home. They were not feeling neglected at all.",children;family,,,
,EM:,How did they feel seeing you back home in that showbiz kind of arrival?,,,,
,Chitani Sane Amidu:,"Actually, they felt great. They had great expectations from their dad. Hence, in my case, I used to bring clothes for my wife, my children that they too dressed like their friends in South Africa. When they walk outside the house, people should really feel that their father or husband has arrived from South Africa",family;clothing;marriage;children,,,
,EM:,"Oh, this is great story. Anyone else?",,,,
,Kaliza Bazilio:,"Like I used to send money every two months to my wife that she should not lack anything. However, I was disappointed to note that she was also dating another man. She was not satisfied with my support. So, when I came back, I told her that I wouldn’t want to compete for one woman. I had to leave her. If I had stayed with her, I would have died as she attempted to poison me once, thank God I vomited and survived. That I had to let her go. The good news is that I managed to take care of my children. ",marriage;poverty;children;divorce,,,
,EM:,"So, this separation didn’t affect your kids?",children;marriage;divorce,,,
,Kaliza Bazilio:,"No, this separation did not affect them at all. Now they are grown up and with their own families too.",children;marriage;family;divorce,,,
,EM:,"So, did you marry again?",marriage,,,
,Kaliza Bazilio:,"Yes, I did marry again and was blessed with 7 children, 4 alive and 3 passed on. All of them have their own families and children. So, I have a full village here.",marriage;children,,,
,EM:,Anyone else who wants to contribute?,,,,
,Pearson Kumbemba:,"In my case, I lost my wife and remained with my kids. So, remarried another woman. I told her to take care of my 2 kids. As I speak, I now have 28 grandchildren. When I get home, am surrounded by my grandchildren and even forgetting their names. So, my wife really took a really good care of my children. Now, I am a happy man, having been in marriage for 48 years.",marriage;children;family,,,
,EM:,"So, this means you were a supporting husband even while away?",marriage,,,
,Pearson Kumbemba:,"Definitely, I was so supportive. Every two months I used to send money to her that she takes care of our children, that way my wife was not worried at all. She could count on me. She knew that all the help is coming because of the kids she is minding. ",marriage;children,,,
,EM:,"Very interesting. Now, I see someone else trying to give us his account. Your name again, Sir.",,,,
,Matumula Mamu:,"Matumula Mamu. Firstly, when I came first from South Africa, I bought cows, I built a house. My children went to school but only one finished school, up to form 4. The second child didn’t finish school as when I was robbed of the cows, I was left with nothing to assist them with fees. So, the second one left while in form 3. When my wife died, I decided not to marry so that I could take care of the kids. So, I am really in deep poverty. Some came back from their marriages; others lost their husbands.",purchases;education;marriage;children;poverty;family,,,
,EM:,"So, you mean one of your children stole your herd of cows?",,,,
